{
  "last_validation": {
    "gate": "research_to_review",
    "validated_at": "2026-04-29T00:00:00Z",
    "validator_exit_code": 0
  },
  "last_validations": {
    "ideation_to_research": {
      "gate": "ideation_to_research",
      "validated_at": "2026-04-29T00:00:00Z",
      "validator_exit_code": 0
    },
    "research_to_review": {
      "gate": "research_to_review",
      "validated_at": "2026-04-29T00:00:00Z",
      "validator_exit_code": 0
    },
    "review_to_writeup": {
      "gate": "review_to_writeup",
      "validated_at": "2026-04-29T00:00:00Z",
      "validator_exit_code": 0
    }
  },
  "phase": "review",
  "run_id": "minimal-run",
  "status": "validated",
  "strictness_mode": "scientist"
}
